{
  "schema_version": "0.1",
  "trace_id": "550e8400-e29b-41d4-a716-446655440300",
  "run_id": "550e8400-e29b-41d4-a716-446655440001",
  "step_id": "550e8400-e29b-41d4-a716-446655440002",
  "tool_id": "rag_search",
  "policy_context": {
    "company_id": "tmki",
    "project_id": "satimol",
    "department_id": "markscheider",
    "project_role": "Chefmarkscheider",
    "employee_id": "emp_litovsky",
    "clearance": "internal",
    "env": "production"
  },
  "input": {
    "query": "маркшейдерская съёмка участок КС",
    "top_k": 8,
    "hybrid": true
  },
  "confirmed_by_user": false
}
